,COMPANY,DATE_JOINED,COUNTRY,CITY,INDUSTRY,INVESTOR,VALUATION_IN$B
836,At-Bay,2021-07-27,United States,Mountain View,Fintech,"Lightspeed Venture Partners, Khosla Ventures, Munich Re Ventures",1.12
837,Visby Medical,2022-03-01,United States,San Jose,Health,"Artiman Ventures, Pitango Venture Capital, Valo Ventures",1.12
838,Invoca,2022-06-14,United States,Santa Barbara,Artificial intelligence,"Upfront Ventures, Accel, Industry Ventures",1.1
839,TangoMe,2014-03-20,United States,Mountain View,Mobile & telecommunications,"Draper Fisher Jurtson, Qualcomm Ventures, Alibaba Group",1.1
840,AppDirect,2015-10-07,United States,San Francisco,E-commerce & direct-to-consumer,"Mithril, iNovia Capital, Foundry Group",1.1
841,Juanpi,2016-04-14,China,Wuhan,E-commerce & direct-to-consumer,"Tiantu Capital, SAIF Partners China, Newsion Venture Capital",1.1
842,OVH,2016-08-15,France,Roubaix,Other,"KKR, TowerBrook Capital Partners",1.1
843,GetYourGuide,2019-05-16,Germany,Berlin,Travel,"Spark Capital, Highland Europe, Sunstone Capital",1.1
844,Ivalua,2019-05-21,United States,Redwood City,Fintech,"Ardian, Tiger Global Management, KKR",1.1
845,Sisense,2020-01-09,United States,New York,Data management & analytics,"Opus Capital, Genesis Partners, Battery Ventures",1.1
846,Pharmapacks,2020-11-12,United States,Islandia,E-commerce & direct-to-consumer,The Carlyle Group,1.1
847,Sennder,2021-01-14,Germany,Berlin,"Supply chain, logistics, & delivery","Accelm Scania Growth Capital, Lakestar",1.1
848,Nexthink,2021-02-08,Switzerland,Prilly,Data management & analytics,"Auriga, Galeo Ventures, Highland Europe",1.1
849,Zego,2021-03-09,United Kingdom,London,Fintech,"LocalGlobe, Balderton Capital, Target Global",1.1
850,Rightway,2021-03-30,United States,New York,Health,"Thrive Capital, Khosla Ventures, Tiger Global Management",1.1
851,Sunbit,2021-05-20,United States,Los Angeles,Fintech,"Zeev Ventures, Group11, Chicago Ventures",1.1
852,Qingting FM,2021-06-02,China,Shanghai,Internet software & services,"China Culture Industrial Investment Fund, We Capital, China Minsheng Investment Group",1.1
853,G2,2021-06-22,United States,Chicago,Internet software & services,"Pritzker Group Venture Capital, Accel, Hyde Park Venture Partners",1.1
854,Hailo,2021-10-12,Israel,Tel Aviv,Artificial intelligence,"Glory Ventures, Maniv Mobility",1
855,Caribou,2022-05-23,United States,Denver,Fintech,"CMFG Ventures, Accomplice, Moderne Ventures",1.1
856,Nowports,2022-05-24,Mexico,Monterrey,"Supply chain, logistics, & delivery","Monashees+, Foundation Capital, Base10 Partners",1.1
857,People.ai,2021-08-11,United States,San Francisco,Internet software & services,"GGV Capital, Lightspeed Venture Partners, ICONIQ Capital",1.1
858,Carousell,2021-09-15,Singapore,NA,E-commerce & direct-to-consumer,"500 Global, Rakuten Ventures, Golden Gate Ventures",1.1
859,apna,2021-09-15,India,Bengaluru,Internet software & services,"Sequoia Capital India, Rocketship.vc, Lightspeed India Partners",1.1
860,Karat,2021-10-13,United States,Seattle,Internet software & services,"8VC, Norwest Venture Partners, Tiger Global Management",1.1
861,Enpal,2021-10-18,Germany,Berlin,Internet software & services,"HV Capital, Softbank Group, BlackRock",1.1
862,Acko General Insurance,2021-10-28,India,Bengaluru,Fintech,"Intact Ventures, Munich Re Ventures, General Atlantic",1.1
863,Daily Harvest,2021-11-16,United States,New York,E-commerce & direct-to-consumer,"M13, Lightspeed Venture Partners, Lone Pine Capital",1.1
864,The Bank of London,2021-11-30,United Kingdom,London,Fintech,"Mangrove Capital Partners,14W. ForgeLight",1.1
865,Fundbox,2021-11-30,United States,San Francisco,Fintech,"Khosla Ventures, General Catalyst, Blumberg Capital",1.1
866,Turing,2021-12-20,United States,Palo Alto,Internet software & services,"Foundation Capital, Frontier Ventures, AltaIR Capital",1.1
867,GlobalBees,2021-12-28,India,New Delhi,E-commerce & direct-to-consumer,"Chiratae Ventures, SoftBank Group, Trifecta Capital",1.1
868,LEAD School,2022-01-13,India,Andheri,Edtech,"WestBridge Capital, GSV Ventures, Elevar Equity",1.1
869,eSentire,2022-02-22,Canada,Waterloo,Cybersecurity,"Edison Partners, Georgian Partners, VentureLink",1.1
870,Beyond Identity,2022-02-22,United States,New York,Cybersecurity,"New Enterprise Associates, Koch Disruptive Technologies, Evolution Equity Partners",1.1
871,Staffbase,2022-03-15,Germany,Chemnitz,Internet software & services,"Insight Partners, e.ventures, General Atlantic",1.1
872,Chief,2022-03-31,United States,New York,Other,"General Catalyst, Inspired Capital, Flybridge Capital Partners",1.1
873,IntelyCare,2022-04-06,United States,Quincy,Health,"Kaiser Permanente Ventures, Endeavour Vision, LRVHealth",1.1
874,Teleport,2022-05-03,United States,Oakland,Cybersecurity,"Kleiner Perkins Caufield & Byers, s28 Capital, Insight Partners",1.1
875,Imply Data,2022-05-17,United States,Burlingame,Data management & analytics,"Andreessen Horowitz, Bessemer Venture Partners, Khosla Ventures,",1.1
876,Material Security,2022-05-11,United States,Redwood City,Cybersecurity,"Andreessen Horowitz, Founders Fund",1.1
877,PhysicsWallah,2022-06-07,India,Uttar Pradesh,Edtech,"GSV Ventures, WestBridge Capital",1.1
878,Recover,2022-06-09,Spain,Banyeres de Mariola,Other,"Goldman Sachs Asset Management, STORY3 Capital Partners",1.1
879,Purplle,2022-06-09,India,Mumbai,E-commerce & direct-to-consumer,"Blume Ventures, JSW Ventures, IvyCap Ventures",1.1
880,CAIS,2022-01-11,United States,New York,Fintech,"Franklin Templeton, Motive Partners. Apollo Global Management",1.1
881,Nxin,2018-09-18,China,Beijing,Internet software & services,"Beijing Juneng Hesheng Industry Investment Fund, Beijing Shuju Xinrong Fund",1.08
882,UISEE Technology,2021-01-25,China,Beijing,"Supply chain, logistics, & delivery","Shenzhen Capital Group, Robert Bosch Venture Capital, SeptWolves Ventures",1.08
883,56PINGTAI,2021-01-25,China,Shanghai,"Supply chain, logistics, & delivery","QF Capital, QC Capital, Unicom Innovation Venture Capital",1.08
884,Cirkul,2022-06-13,United States,Sarasota,Consumer & retail,"AF Ventures, Siddhi Capital, SC.Holdings",1.07
885,Rubicon,2017-08-25,United States,Atlanta,Other,"Goldman Sachs, Leonardo DiCaprio, Promecap",1.07
886,Radius Payment Solutions,2017-11-27,United Kingdom,Crewe,Fintech,Inflexion Private Equity,1.07
887,Rivigo,2019-07-11,India,Gurgaon,"Supply chain, logistics, & delivery","SAIF Partners India, Warburg Pincus, Trifecta Capital Advisors",1.07
888,Mamaearth,2021-12-28,India,Gurgaon,E-commerce & direct-to-consumer,"Fireside Ventures, Sequoia Capital India, Stellaris Venture Partners",1.07
889,0x,2022-04-26,United States,San Francisco,Fintech,"Jump Capital, Pantera Capital, Greylock Partners",1.05
890,Jiuxian,2015-07-30,China,Beijing,E-commerce & direct-to-consumer,"Sequoia Capital China, Rich Land Capital, Merrysunny Wealth",1.05
891,Instabase,2019-10-21,United States,San Francisco,Data management & analytics,"New Enterprise Associates, Greylock Partners, Andreessen Horowitz",1.05
892,Sendbird,2021-04-06,United States,San Mateo,Mobile & telecommunications,"FundersClub, Y Combinator, Tiger Global Management",1.05
893,Density,2021-11-10,United States,San Francisco,Hardware,"Founders Fund, Upfront Ventures, 01 Advisors",1.05
894,Mixpanel,2021-11-15,United States,San Francisco,Internet software & services,"Bain Capital Tech Opportunities, Andreessen Horowitz, Sequoia Capital",1.05
895,Aprogen,2019-05-31,South Korea,Seongnam-Si,Health,"Lindeman Asia Investment, Nichi-Iko Pharmaceutical",1.04
896,OrCam Technologies,2018-02-20,Israel,Jerusalem,Artificial intelligence,"Intel Capital, Aviv Venture Capital",1.03
897,Ample,2021-11-11,United States,San Francisco,Hardware,"Shell Ventures, Blackstone, Moore Strategic Ventures",1.02
898,Leap Motor,2018-11-20,China,Hangzhou,Auto & transportation,"Sequoia Capital China, Gopher Asset Management, Shanghai Electric Group",1.01
899,Wheel,2022-01-19,United States,Austin,Health,"Silverton Partners, Tusk Ventures, CRV",1.01
900,Flow,2022-08-15,United States,New York,Fintech,Andreessen Horowitz,1
901,Turntide Technologies,2022-06-15,United States,Sunnyvale,Auto & transportation,"Meson Capital Partners, Fifth Wall Ventures, OGCI Climate Investments",1
902,EcoVadis,2022-06-14,France,Paris,"Supply chain, logistics, & delivery","Astorg Partners, Princeville Global, Beyond Net Zero",1
903,TransferMate,2022-05-22,Ireland,Kilkenny,Fintech,Railway Pension Trustee Co. Ltd.,1
904,Lookout,2013-10-10,United States,San Francisco,Cybersecurity,"Accel Partners, Greylock Partners, Lowercase Capital",1
905,Perimeter 81,2022-06-06,Israel,Tel Aviv,Cybersecurity,"Insight Partners, Toba Capital, Spring Ventures",1
906,Snapdeal,2014-05-21,India,New Delhi,E-commerce & direct-to-consumer,"SoftBankGroup, Blackrock, Alibaba Group",1
907,TechStyle Fashion Group,2014-08-29,United States,El Segundo,E-commerce & direct-to-consumer,"Matrix Partners, Passport Capital, Rho Ventures",1
908,InMobi,2014-12-02,India,Bengaluru,Mobile & telecommunications,"Kleiner Perkins Caufield & Byers, Softbank Corp., Sherpalo Ventures",1
909,LinkSure Network,2015-01-01,China,Shanghai,Mobile & telecommunications,NA,1
910,Red Ventures,2015-01-07,United States,Fort Mill,Other,"Silver Lake Partners, General Atlantic",1
911,BeiBei,2015-01-22,China,Hangzhou,E-commerce & direct-to-consumer,"Banyan Capital, New Horizon Capital, IDG Capital Partners",1
912,Lamabang,2015-03-06,China,Shenzhen,E-commerce & direct-to-consumer,"5Y Capital, Matrix Partners China, K2VC",1
913,JimuBox,2015-04-21,China,Beijing,Fintech,"Matrix Partners China, Ventech China, Shunwei Capital Partners",1
914,FXiaoKe,2015-07-02,China,Beijing,Mobile & telecommunications,"IDG Capital, Northern Light Venture Capital, DCM Ventures",1
915,Vox Media,2015-08-12,United States,Washington,Internet software & services,"Accel Partners, Comcast Ventures, General Atlantic",1
916,Mia.com,2015-09-08,China,Beijing,E-commerce & direct-to-consumer,"Sequoia Capital China, ZhenFund, K2 Ventures",1
917,58 Daojia,2015-10-12,China,Beijing,Internet software & services,"KKR, Alibaba Group, Ping An Insurance",1
918,Womai,2015-10-12,China,Beijing,E-commerce & direct-to-consumer,"SAIF Partners China, Baidu, IDG Capital",1
919,HuJiang,2015-10-29,China,Shanghai,Edtech,"China Minsheng Investment, Baidu, Wanxin Media",1
920,iTutorGroup,2015-11-18,China,Shanghai,Edtech,"QiMing Venture Partners, Temasek Holdings, Silverlink Capital",1
921,MindMaze,2016-01-28,Switzerland,Lausanne,Health,Hinduja Group,1
922,iCarbonX,2016-04-12,China,Shenzhen,Artificial intelligence,"Tencent, Vcanbio",1
923,SMS Assist,2016-06-07,United States,Chicago,Internet software & services,"Goldman Sachs, Insights Venture Partners, Pritzker Group Venture Capital",1
924,Kendra Scott,2016-12-21,United States,Austin,Consumer & retail,"Berkshire Partners, Norwest Venture Partners",1
925,Mobvoi,2017-04-06,China,Beijing,Consumer & retail,"Sequoia Capital China, SIG Asia Investments, ZhenFund",1
926,Zhuan Zhuan,2017-04-18,China,Beijing,E-commerce & direct-to-consumer,"58.com, Tencent Holdings",1
927,Modernizing Medicine,2017-05-10,United States,Boca Raton,Health,"Warburg Pincus, Summit Partners, Sands Capital",1
928,Zhaogang,2017-06-29,China,Shanghai,E-commerce & direct-to-consumer,"K2 Ventures, Matrix Partners China, IDG Capital",1
929,DianRong,2017-08-02,China,Shanghai,E-commerce & direct-to-consumer,"Standard Chartered, FinSight Ventures, Affirma Capital",1
930,Cell C,2017-08-07,South Africa,Midrand,Mobile & telecommunications,"Blue Label Telecoms, Net1 UEPS Technologies",1
931,YH Global,2017-09-21,China,Shenzhen,"Supply chain, logistics, & delivery","Co-Energy Finance, Grandland",1
932,Revolution Precrafted,2017-10-23,Philippines,Manila,Other,"K2 Global, 500 Startups",1
933,WeLab,2017-11-08,Hong Kong,NA,Fintech,"Sequoia Capital China, ING, Alibaba Entrepreneurs Fund",1
934,Maimai,2017-11-15,China,Beijing,Mobile & telecommunications,"Morningside Venture Capital, IDG Capital, DCM Ventures",1
935,Dxy.cn,2018-04-10,China,Hangzhou,Health,"Tencent Holdings, DCM Ventures",1
936,HMD Global,2018-05-21,Finland,Espoo,Mobile & telecommunications,Ginko Ventures,1
937,Huike Group,2018-05-24,China,Beijing,Edtech,"Fosun RZ Capital, Oceanwide Holdings, Shenzhen Qianhe Capital Management Co.",1
938,China Cloud,2018-06-11,China,Wuxi,Hardware,"V Star Capital, GF Xinde Investment Management Co., Haitong Leading Capital Management",1
939,LinkDoc Technology,2018-07-05,China,Beijing,Health,"China Investment Corporation, New Enterprise Associates",1
940,MediaMath,2018-07-10,United States,New York,Internet software & services,"Silicon Valley Bank, QED Investors, European Founders Fund",1
941,Movile,2018-07-12,Brazil,Sao Paulo,Mobile & telecommunications,"Innova Capital - FIP, 3G Capital Management, Prosus Ventures",1
942,Pat McGrath Labs,2018-07-16,United States,New York,Consumer & retail,"One Luxury Group, Eurazeo",1
943,Wacai,2018-07-18,China,Hangzhou,Mobile & telecommunications,"Qiming Venture Partners, China Broadband Capital, CDH Investments",1
944,FlashEx,2018-08-27,China,Beijing,"Supply chain, logistics, & delivery","Prometheus Capital, Matrix Partners China, JD Capital Management",1
945,Banma Network Technologies,2018-09-13,China,Shanghai,Auto & transportation,"Yunfeng Capital, SDIC Innovation Investment Management, Shang Qi Capital",1
946,Tresata,2018-10-10,United States,Charlotte,Fintech,GCP Capital Partners,1
947,Momenta,2018-10-17,China,Beijing,Artificial intelligence,"Sinovation Ventures, Tencent Holdings, Sequoia Capital China",1
948,Hosjoy,2018-10-18,China,Nanjing,E-commerce & direct-to-consumer,"U.S.-China Green Fund, Founder H Fund, Richland Equities",1
949,Omio,2018-10-23,Germany,Berlin,Travel,"Lakestar, Battery Ventures, New Enterprise Associates",1
950,TERMINUS Technology,2018-10-25,China,Beijing,Hardware,"China Everbright Limited, IDG Capital, iFLYTEK",1
951,BitFury,2018-11-06,Netherlands,Amsterdam,Hardware,"Georgian Co-Investment Fund, iTech Capital, Galaxy Digital",1
952,iFood,2018-11-13,Brazil,Osasco,"Supply chain, logistics, & delivery","Movile, Just Eat, Naspers",1
953,REEF Technology,2018-12-10,United States,Miami,"Supply chain, logistics, & delivery","Target Global, UBS Asset Management, Mubadala Capital",1
954,Globality,2019-01-22,United States,Menlo Park,Artificial intelligence,SoftBank Group,1
955,Ynsect,2019-02-21,France,Evry,Other,"Astanor Ventures, Upfront Ventures, IDInvest Partners",1
956,Intellifusion,2019-03-22,China,Shenzhen,Artificial intelligence,"BOC International, TopoScend Capital, Hongxiu VC",1
957,Poizon,2019-04-29,China,Shanghai,Mobile & telecommunications,"DST Global, Sequoia Capital China, Gaorong Capital",1
958,VTS,2019-05-07,United States,New York,Internet software & services,"Trinity Ventures, Fifth Wall Ventures, OpenView Venture Partners",1
959,SITECH DEV,2019-05-16,China,Guiyang,Other,China Prosperity Capital,1
960,KnowBox,2019-05-30,China,Beijing,Edtech,"TAL Education Group, Legend Star, Alibaba Group",1
961,Yanolja,2019-06-10,South Korea,Seoul,Travel,"SBI Investment Korea, Partners Investment, GIC",1
962,Meero,2019-06-18,France,Paris,Artificial intelligence,"Aglae Ventures, Global Founders Capital, Alven Capital",1
963,Ibotta,2019-08-06,United States,Denver,Fintech,"Koch Disruptive Technologies, Teamworthy Ventures, GGV Capital",1
964,C2FO,2019-08-07,United States,Leawood,Fintech,"Union Square Ventures, Summerhill Venture Partners, Mithril Capital Management",1
965,Numbrs,2019-08-22,Switzerland,Zurich,Fintech,"Investment Corporation of Dubai, Centralway",1
966,EBANX,2019-10-16,Brazil,Curitiba,Fintech,"FTV Capital, Endeavor",1
967,KK Group,2019-10-23,China,Dongguan,E-commerce & direct-to-consumer,"Matrix Partners China, Bright Venture Capita, Shenzhen Capital Group",3
968,Alto Pharmacy,2020-01-30,United States,San Francisco,Health,"Jackson Square Ventures, Greenoaks Capital Management, Softbank Group",1
969,Hotmart,2020-03-17,Netherlands,Amsterdam,E-commerce & direct-to-consumer,"Technology Crossover Ventures, Alkeon Capital Management, General Atlantic",1
970,Emerging Markets Property Group,2020-04-28,United Arab Emirates,Dubai,Other,"OLX Group, KCK Group, EXOR Seeds",1
971,Quizlet,2020-05-13,United States,San Francisco,Edtech,"Union Square Ventures, Altos Ventures, Costanoa Ventures",1
972,Orca Bio,2020-06-17,United States,Menlo Park,Health,"Lightspeed Venture Partners, Data Collective, 8VC",1
973,Infobip,2020-07-30,Croatia,Vodnjan,Mobile & telecommunications,One Equity Partners,1
974,Zwift,2020-09-16,United States,Long Beach,E-commerce & direct-to-consumer,"Novator Partners, True, Causeway Media Partners",1
975,Playco,2020-09-21,Japan,Tokyo,Other,"Sozo Ventures, Caffeinated Capital, Sequoia Capital",1
976,Socar,2020-10-16,South Korea,Jeju-do,Auto & transportation,"Bain Capital, Altos Ventures, Songhyun Investment",1.07
977,Gousto,2020-11-03,United Kingdom,London,"Supply chain, logistics, & delivery","MMC Ventures, BGF Ventures, Unilever Ventures",1.7
978,Boom Supersonic,2020-12-16,United States,Englewood,Other,"WRVI Capital, Caffeinated Capital, Y Combinator",1
979,Quantum Metric,2021-01-07,United States,Colorado Springs,Data management & analytics,"Insight Partners, Bain Capital Ventures",1
980,News Break,2021-01-07,United States,Mountain View,Internet software & services,"IDG Capital, Francisco Partners, ZhenFund",1
981,MadeiraMadeira,2021-01-07,Brazil,Parana,E-commerce & direct-to-consumer,"Flybridge Capital Partners, SoftBank Group, Monashees+",1
982,PPRO,2021-01-19,United Kingdom,London,Fintech,"Wellington Management, Eurazeo, Citi Ventures",1
983,Splashtop,2021-01-27,United States,San Jose,Internet software & services,"Storm Ventures, DFJ DragonFund, New Enterprise Associates",1
984,Flash Express,2021-02-01,Thailand,Bangkok,"Supply chain, logistics, & delivery","SCB 10X, Krungsri Finnovate, eWTP Capital",1
985,Axiom Space,2021-02-16,United States,Houston,Other,"C5 Capital, Hemisphere Ventures, The Venture Collective",1
986,Locus Robotics,2021-02-17,United States,Wilmington,Hardware,"Scale Venture Partners, Bond, Tiger Global Management",1
987,Standard,2021-02-17,United States,San Francisco,Artificial intelligence,"CRV, Y Combinator, Initialized Capital",1
988,WeBull,2021-02-18,China,Changsha,Fintech,"Bojiang Capital, Hongdao Capital, Mobai Capital",1
989,Skydio,2021-02-25,United States,Redwood City,"Supply chain, logistics, & delivery","Andreessen Horowitz, Andreessen Horowitz, Institutional Venture Partners, Accel",1
990,Newsela,2021-02-25,United States,New York,Edtech,"Owl Ventures, Technology Crossover Ventures, Tao Capital Partners",1
991,Aqua Security,2021-03-10,Israel,Ramat Gan,Cybersecurity,"TLV Partners, Lightspeed Venture Partners, M12",1
992,PatSnap,2021-03-16,Singapore,NA,Internet software & services,"Sequoia Capital China, Shunwei Capital Partners, Qualgro",1
993,Evidation,2021-03-22,United States,San Mateo,Health,"B Capital Group,, GE Ventures, McKesson Ventures",1
994,Sidecar Health,2021-01-26,United States,El Segundo,Fintech,"GreatPoint Ventures, Tiger Global Management, Menlo Ventures",1
995,Feedzai,2021-03-24,United States,San Mateo,Artificial intelligence,"Global Founders Capital, Shea Ventures, Greycroft",1
996,Yunxuetang,2021-03-29,China,Suzhou,Edtech,"Matrix Partners China, Sequoia Capital China, Hundreds Capital",1
997,Cameo,2021-03-30,United States,Chicago,Internet software & services,"Lightspeed Venture Partners, Kleiner Perkins Caufield & Byers, Origin Ventures",1
998,Hyperchain,2021-04-11,China,Hangzhou,Fintech,"Yinhong Equity Investment Fund, E Fund, Ideal International",1
999,The Zebra,2021-04-12,United States,Austin,E-commerce & direct-to-consumer,"Silverton Partners, Accel, Ballast Point Ventures",1
1000,Clearcover,2021-04-13,United States,Chicago,Fintech,"American Family Ventures, Cox Enterprises, OMERS Ventures",1
1001,Groq,2021-04-14,United States,Mountain View,Artificial intelligence,"TDK Ventures, Social Capital, D1 Capital Partners",1
1002,Fiture,2021-04-14,China,Chengdu,Health,"Bertelsmann Asia Investments, Sequoia Capital China, NIO Capital",1
1003,Injective Protocol,2021-04-20,United States,New York,Fintech,"Pantera Capital, Cadenza Ventures, BlockTower Capital",1
1004,Sift,2021-04-22,United States,San Francisco,Artificial intelligence,"Union Square Ventures, Insight Partners, Spark Capital",1
1005,SaltPay,2021-04-09,United Kingdom,London,Fintech,"Tiger Global Management, Hedosophia",1
1006,Capsule,2021-04-28,United States,New York,Health,"Thrive Capital, Durable Capital Partners, G Squared",1
1007,MOLOCO,2021-04-29,United States,Redwood City,Artificial intelligence,"Smilegate Investment, DSC Investments, KTB Ventures",1.5
1008,Mux,2021-04-30,United States,San Francisco,Internet software & services,"Accel, Cobalt Capital, Andreessen Horowitz",1
1009,XForcePlus,2021-06-01,China,Shanghai,Internet software & services,"Eastern Bell Capital, Danhua Capital, MSA Capital",1
1010,Firefly Aerospace,2021-05-04,United States,Cedar Park,Other,"XBTO Ventures, Raven One Ventures, SK Ventures",1.1
1011,Shift Technology,2021-05-06,France,Paris,Artificial intelligence,"Griffin Gaming Partners, Andreessen Horowitz, Battery Ventures",1
1012,TensTorrent,2021-05-05,Canada,Toronto,Artificial intelligence,"Eclipse Ventures, Fidelity Investments, Moore Capital Management",1
1013,Zihaiguo,2021-05-06,China,Chongqing,Consumer & retail,"Xingwang Investment Management, China Capital Investment Group, Matrix Partners China",1
1014,Forte Labs,2021-05-12,United States,San Francisco,Fintech,"Iris Capital, Accel, Elaia Partners",1.73
1015,Axtria,2021-05-13,United States,Berkeley Heights,Data management & analytics,"Helion Venture Partners, Bain Capital Tech Opportunities, Sequoia Capital India",1
1016,Amount,2021-05-17,United States,Chicago,Fintech,"Invus Group, Hanaco Venture Capital, WestCap Group",1
1017,Vise,2021-05-18,United States,New York,Fintech,"Sequoia Capital, Founders Fund, Bling Capital",1
1018,Printful,2021-05-24,United States,Charlotte,Other,Bregal Sagemount,1
1019,Matrixport,2021-06-01,Singapore,NA,Fintech,"Dragonfly Captial, Qiming Venture Partners, DST Global",1.05
1020,Shippo,2021-06-02,United States,San Francisco,"Supply chain, logistics, & delivery","Version One Ventures, Uncork Capital, Bessemer Venture Partners",1
1021,Thirty Madison,2021-06-02,United States,New York,Health,"Northzone Ventures, Maveron, Johnson & Johnson Innovation",1
1022,LetsGetChecked,2021-06-07,Ireland,Dublin,Health,"Optum Ventures, Qiming Venture Partners, Transformation Capital",1
1023,EcoFlow,2021-06-10,China,Shenzhen,Hardware,"Delian Capital, China International Capital Corporation, Sequoia Capital China",1
1024,Carro,2021-06-14,Singapore,NA,E-commerce & direct-to-consumer,"SingTel Innov8, Alpha JWC Ventures, Golden Gate Ventures",1
1025,Tractable,2021-06-16,United Kingdom,London,Artificial intelligence,"Insight Partners, Ignition Partners, Georgian Partners",1
1026,Xiaoe Tech,2021-06-15,China,Shenzhen,Internet software & services,"GGV Capital, Hillhouse Capital Management, IDG Capital",1
1027,Bringg,2021-06-16,Israel,Tel Aviv,"Supply chain, logistics, & delivery","Salesforce Ventures, next47, Pereg Ventures",1
1028,Claroty,2021-06-17,United States,New York,Cybersecurity,"Bessemer Venture Partners, MoreVC, Team8",1
1029,JoyTunes,2021-06-21,Israel,Tel Aviv,Edtech,"Genesis Partners, Aleph, Insight Partners",1
1030,Aircall,2021-06-23,United States,New York,Internet software & services,"Balderton Capital, Next World Capital, Draper Esprit",1
1031,Worldcoin,2021-06-29,United States,San Francisco,Fintech,"Day One Ventures, Coinbase Ventures, Andreessen Horowitz",1
1032,SmartAsset,2021-06-24,United States,New York,Fintech,"Javelin Venture Partners, TTV Capital, Peterson Ventures",1
1033,Morning Consult,2021-06-08,United States,Washington DC,Internet software & services,"Advance Venture Partners, Susquehanna Growth Equity, Lupa Systems",1
1034,Visier,2021-06-29,Canada,Vancouver,Internet software & services,"Foundation Capital, Summit Partners, Adams Street Partners",1
1035,ShipBob,2021-06-29,United States,Chicago,"Supply chain, logistics, & delivery","Hyde Park Venture Partners,	FundersClub. Bain Capital Ventures",1
1036,bolttech,2021-07-01,Singapore,NA,Fintech,"Mundi Ventures, Doqling Capital Partners, Activant Capital",1
1037,MobileCoin,2021-07-07,United States,San Francisco,Fintech,"General Catalyst, Future Ventures, AU21",1.06
1038,Amperity,2021-07-13,United States,Seattle,Artificial intelligence,"Madrona Venture Group, Tiger Global Management, Madera Technology Partners",1
1039,Pantheon Systems,2021-07-13,United States,San Francisco,Internet software & services,"Foundry Group, Scale Venture Partners, SoftBank Group",1
1040,Xiaobing,2021-07-12,China,Beijing,Fintech,"NetEase Capital, Northern Light Venture Capital, Microsoft",1
1041,dMed Biopharmaceutical,2021-07-12,China,Shanghai,Health,"Qiming Venture Partners, Vivo Capital, Sequoia Capital China",1
1042,Carson Group,2021-07-14,United States,Lincoln,Fintech,Bain Capital,1
1043,GO1,2021-07-19,Australia,Brisbane,Internet software & services,"Y Combinator, M12, SEEK",1
1044,Interos,2021-07-22,United States,Arlington,"Supply chain, logistics, & delivery","Kleiner Perkins Caufield & Byers, NightDragon Security, Venrock",1
1045,BlackBuck,2021-07-22,India,Bengaluru,"Supply chain, logistics, & delivery","Accel, Sands Capital, International Finance Corporation",1
1046,NIUM,2021-07-13,Singapore,NA,Fintech,"Vertex Ventures SE Asia, Global Founders Capital, Visa Ventures",1
1047,Human Interest,2021-08-04,United States,San Francisco,Fintech,"Wing Venture Capital, Slow Ventures, Uncork Capital",1
1048,Bluecore,2021-08-05,United States,New York,Artificial intelligence,"FirstMark Capital, Georgian Partners, Norwest Venture Partners",1
